repo_name,purpose,query,platform,original_path
TomSpencerLondon_aws-lambda-tuning,powertune aws lambda function by invoking function with different calculation,powertune aws lambda optimize cost save,aws,storage/nfs/aws/9401-9601/TomSpencerLondon_aws-lambda-tuning
pjd1271_pinball-scoreboard-api,pinball scoreboard api,pinball scoreboard api,serverless,storage/nfs/serverless/4600-4800/pjd1271_pinball-scoreboard-api
blibor_spreadshare-image-optimizer,image microservice to compress and store images in s3,image microservice compress image s3,serverless,storage/nfs/serverless/21600-21800/blibor_spreadshare-image-optimizer
vbezgachev_tf_aws_lambda,serverless GAN model using tensorflow,serverless GAN generated adversarial network tensorflow,serverless,storage/nfs/serverless/19200-19400/vbezgachev_tf_aws_lambda
nicor88_aws-state-machine-etl,extract translate and load ETL based on state machine and lambda,etl ETL state machines serverless functions extract translate and load,serverless,storage/nfs/serverless/16800-17000/nicor88_aws-state-machine-etl
verypossible_pychain,blockchain in serverless setting,blockchain serverless sample application,serverless,storage/nfs/serverless/16000-16200/verypossible_pychain
succulentpup_serverless-image-reducer,image resize in serverless,image resize reducer serverless,serverless,storage/nfs/serverless/28600-28800/succulentpup_serverless-image-reducer
wuh0007_severless_ML_live,machine learning model of regression nlp visualization and resnet classifier,machine learning model regression nlp visualization and resnet classifier,serverless,storage/nfs/serverless/3600-3800/wuh0007_severless_ML_live
gakpenting_IBM-autoai,machine learning model for prediction using ibm auto ai,machine learning model prediction using ibm auto ai,serverless,storage/nfs/serverless/26400-26600/gakpenting_IBM-autoai
uport-project_lambda-unnu,feature to enable contract structure for the device key blockchain,feature contract structure device key blockchain,serverless,storage/nfs/serverless/1800-2000/uport-project_lambda-unnu
lkcozy_blockchain,application related to blockchain,application blockchain,serverless,storage/nfs/serverless/29400-29600/lkcozy_blockchain
BlockchainZoo_keyhub-vault,an application to manage keyhub vault for blockchain,keyhub vault key blockchain,serverless,storage/nfs/serverless/3000-3200/BlockchainZoo_keyhub-vault
afigar_anesthesia-blockchain-sns,aws lambda function in nodejs triggered by SNS message that saves data to BigchainDB,aws sns blockchain trigger message BigchainDB,serverless,storage/nfs/serverless/2200-2400/afigar_anesthesia-blockchain-sns
ConsenSysMesh_Luxarity-SensuiMod,proper blockchain implementation for serverless,blockchain implementation,serverless,storage/nfs/serverless/23000-23200/ConsenSysMesh_Luxarity-SensuiMod
singnet_snet-marketplace-service,service for decentralized blockchain marketplace,service marketplace blockchain,serverless,storage/nfs/serverless/11400-11600/singnet_snet-marketplace-service
peepsx_dnames-beta,signup system based on arisen blockchain,signup system based on arisen blockchain,serverless,storage/nfs/serverless/22000-22200/peepsx_dnames-beta
countableSet_swimming-goggles,aws lambda to update s3 bucket policy with cloudflare ip addresses,aws lambda update s3 bucket policy cloudflare ip addresses,aws,storage/nfs/aws/2601-2801/countableSet_swimming-goggles
JimmyBoyle_FeatureToggles,serverless app for maintaining feature flags,serverless app feature flags,aws,storage/nfs/aws/3601-3801/JimmyBoyle_FeatureToggles
uvasoftware_guarana,debugging tool that captures http request and saves them to s3 for debugging,debugging tool http request capture s3,aws,storage/nfs/aws/13601-13801/uvasoftware_guarana
evanchiu_serverless-galleria,serverless batch photo manipulation and processing image resize blur crop rotate compress sepia,serverless batch photo manipulation image resize blur crop rotate compress sepia,aws,storage/nfs/aws/1401-1601/evanchiu_serverless-galleria
Venafi_aws-private-ca-policy-venafi,allows enforcement of enterprise security policy,allows enforcement enterprise security policy,aws,storage/nfs/serverless/14400-14600/Venafi_aws-private-ca-policy-venafi
Tanbouz_codepipeline-s3-deploy,unwraps compressed input artifact and deploys the files to an s3 bucket with mime types,unwraps compressed input artifact deploy s3 bucket mime types,aws,storage/nfs/aws/8601-8801/Tanbouz_codepipeline-s3-deploy
i001962_serverless-webmerge,copy file and merge fields using aws lambda and webmerge,copy file and merge fields aws lambda webmerge,aws,storage/nfs/aws/8201-8401/i001962_serverless-webmerge
trendmicro_cloudone-filestorage-plugins,cloud one file storage security post-scan,cloud one file storage security post-scan,aws,storage/nfs/aws/12401-12601/trendmicro_cloudone-filestorage-plugins
enr1c091_amazon-cognito-facial-recognition-auth,implementation of passwordless facial recognition authentication,implementation passwordless facial recognition authentication auth,aws,storage/nfs/aws/3601-3801/enr1c091_amazon-cognito-facial-recognition-auth
endk17_faceAuth,implementation of passwordless facial recognition authentication,implementation passwordless facial recognition authentication auth,aws,storage/nfs/aws/1201-1401/endk17_faceAuth
kouz75_lambda-edge-audio,aws cloudformation stack to manipulate audio files with lambda edge,aws cloudformation stack audio files lambda edge,aws,storage/nfs/aws/6201-6401/kouz75_lambda-edge-audio
uvasoftware_scanii-lambda,content processing engine for scanii,content processing engine scanii,aws,storage/nfs/aws/9401-9601/uvasoftware_scanii-lambda
gracious-tech_stello,end to end encrypted messaging service using cloud storage,end to end encrypted messaging service cloud storage,aws,storage/nfs/aws/13201-13401/gracious-tech_stello
QLife-Inc_cloudfront-auth-filter,aws lambda at edge function for authentication and authorization with amazon cloudfront,aws lambda at edge function authentication and authorization cloudfront,aws,storage/nfs/aws/10201-10401/QLife-Inc_cloudfront-auth-filter
tomwwright_littleorange,multi-account blueprint for aws,multi-account blueprint aws,aws,storage/nfs/aws/12401-12601/tomwwright_littleorange
aidenkihyunkim_aws-lambda-update-route53-record-to-ec2-public-ip-python3,performs inserting updating the host record of route53 dns automatically using the cloudwatch event of ec2 state changing,performs inserting updating the host record route53 dns automatically cloudwatch event ec2 state changing,aws,storage/nfs/aws/401-601/aidenkihyunkim_aws-lambda-update-route53-record-to-ec2-public-ip-python3
AllenInstitute_segmentation-labeling-app,custom labelling workflow using aws sagemaker,custom labelling workflow aws sagemaker,aws,storage/nfs/aws/8601-8801/AllenInstitute_segmentation-labeling-app
rewindio_scheduled-psql-script-runner,runs postgres scripts against rds on one of 3 predefined schedules,runs postgres scripts rds on one of 3 predefined schedules,aws,storage/nfs/aws/201-401/rewindio_scheduled-psql-script-runner
mrvladis_privatelinkdns,aws vpc privatelink implementation with dns,aws vpc privatelink implementation dns,aws,storage/nfs/aws/7401-7601/mrvladis_privatelinkdns
debnsuma_MLInference-Lambda-EFS,repository for deploying multiple machine learning models for inference on aws lambda and amazon efs,repository multiple machine learning models inference aws lambda amazon efs,aws,storage/nfs/aws/401-601/debnsuma_MLInference-Lambda-EFS
lbjay_gitwishes,triggers an AWS Lambda function to search github commits for messages from the previous day matching variations of i wish,triggers aws lambda function to search github commits for messages from the previous day matching variations i wish,aws,storage/nfs/aws/1201-1401/lbjay_gitwishes
Shrivallabha_Streaming-Data-Analysis-for-Household-Energy-Consumption,streaming data analysis for household energy consumption,streaming data analysis household energy consumption,aws,storage/nfs/aws/6801-7001/Shrivallabha_Streaming-Data-Analysis-for-Household-Energy-Consumption
groorj_aws-ip-range-api,serverless function to validate an ip address,serverless function ip address,serverless,storage/nfs/serverless/200-400/groorj_aws-ip-range-api
bahlo_serverless-podcast,podcast website implementation using serverless,podcast website implementation serverless,serverless,storage/nfs/serverless/23000-23200/bahlo_serverless-podcast
dmillikan_aws_automation,synchronize local directory to an s3 bucket,synchronize local directory s3 bucket,serverless,storage/nfs/serverless/20600-20800/dmillikan_aws_automation
zaMedvedem_automating-aws-with-python,synchronize local directory to an s3 bucket and notify as well to slack users,synchronize local directory s3 bucket and notify as well slack users,serverless,storage/nfs/serverless/20400-20600/zaMedvedem_automating-aws-with-python
aureliomarcoag_serverless-acm-manager,serverless application that reads domains from files stored in an s3 bucket and creates one acm certificate for each file,serverless application domains files stored s3 bucket create acm certificate,serverless,storage/nfs/serverless/3600-3800/aureliomarcoag_serverless-acm-manager
sreejesh79_Get-Signed-Url-for-S3-upload,generate a cloudfront signed url with an expiry time for s3 bucket access,generate cloudfront signed url expiry time s3 bucket access,serverless,storage/nfs/serverless/17200-17400/sreejesh79_Get-Signed-Url-for-S3-upload
Ennexa_serverless-ddns-updater,dynamic dns updater service,dynamic dns updater service,serverless,storage/nfs/serverless/4600-4800/Ennexa_serverless-ddns-updater
oliome_tap_csv,convert csv to json,convert csv json,serverless,storage/nfs/serverless/13000-13200/oliome_tap_csv
aofry_ec2noip,ec2noip is a Python lambda which update noip.com service when ec2 isntance go up,ec2noip noip service update ec2 instance,serverless,storage/nfs/serverless/7200-7400/aofry_ec2noip
jpswade_checkip,what is my ip address lookup service,what is my ip address lookup service,serverless,storage/nfs/serverless/6200-6400/jpswade_checkip
mgranell_s3-pgp-transform,pgp encrypts files added to an encryption s3 bucket and pgp decrypts files added to a decryption bucket,pgp transform ecrypt s3 decrypt files,serverless,storage/nfs/serverless/14200-14400/mgranell_s3-pgp-transform
servian_aws-auto-remediate,automated remediation of common aws security issues,automated remediation aws security issues,serverless,storage/nfs/serverless/15800-16000/servian_aws-auto-remediate
harshkavdikar1_s3-to-gcs-streaming,data streaming from s3 to google cloud storage,data streaming s3 google cloud storage,serverless,storage/nfs/serverless/17400-17600/harshkavdikar1_s3-to-gcs-streaming
rokumatsumoto_aws-node-dynamic-image-resizer,event driven image resizing,event driven image resizing,serverless,storage/nfs/serverless/18600-18800/rokumatsumoto_aws-node-dynamic-image-resizer
99x_aws-api-gateway-policy-generator,generates aws api gateway policy,generates aws api gateway policy,serverless,storage/nfs/serverless/1000-1200/99x_aws-api-gateway-policy-generator